<?xml version="1.0" encoding="UTF-8"?>
<!--
JBoss, Home of Professional Open Source
Copyright 2010, Red Hat, Inc. and individual contributors
by the @authors tag. See the copyright.txt in the distribution for a
full listing of individual contributors.


This is free software; you can redistribute it and/or modify it
under the terms of the GNU Lesser General Public License as
published by the Free Software Foundation; either version 2.1 of
the License, or (at your option) any later version.


This software is distributed in the hope that it will be useful,
but WITHOUT ANY WARRANTY; without even the implied warranty of
MERCHANTABILITY or FITNESS FOR A PARTICULAR PURPOSE. See the GNU
Lesser General Public License for more details.


You should have received a copy of the GNU Lesser General Public
License along with this software; if not, write to the Free
Software Foundation, Inc., 51 Franklin St, Fifth Floor, Boston, MA
02110-1301 USA, or see the FSF site: http://www.fsf.org.
-->
<visual-suite-result xmlns="http://www.jboss.org/test/visual-suite-result"
	xmlns:xsi="http://www.w3.org/2001/XMLSchema-instance"
	xsi:schemaLocation="http://www.jboss.org/test/visual-suite-result ../../main/resources/visual-suite-result.xsd">
		
	<test name="AjaxSupportTestCase.testEmpty">
		<pattern name="p10" result="differ" output="diffs/AjaxSupportTestCase.testEmpty.1.png">
			<perception>
				<area width="558" height="1145" />
				<rectangle>
					<vertex x="0" y="5" />
					<vertex x="10" y="140" />
				</rectangle>
				<total-pixels>5</total-pixels>
				<masked-pixels>15</masked-pixels>
				<perceptible-different-pixels>345</perceptible-different-pixels>
				<global-different-pixels>53</global-different-pixels>
				<unperceptible-different-pixels>2345</unperceptible-different-pixels>
				<same-pixels>3245</same-pixels>
			</perception>
		</pattern>
		<pattern name="p1" result="same" />
		<pattern name="p2" result="not-tested" />
	</test>
	<test name="BeanValidatorTestCase.testAgeIntegerOnly:168">
		<pattern name="p3" result="differ" />
		<pattern name="p4" result="differ" />
		<pattern name="p5" result="differ" />
	</test>
	<test name="xxx">
		<pattern name="p6" result="perceptually-same" />
		<pattern name="p7" result="not-tested" />
		<pattern name="p8" result="not-tested" />
	</test>
	<test name="yyy">
		<pattern name="p9" result="error" />
		<pattern name="p11" result="same" />
	</test>
</visual-suite-result>