<?xml version="1.0" encoding="UTF-8"?>
<!--

    JBoss, Home of Professional Open Source
    Copyright ${year}, Red Hat, Inc. and individual contributors
    by the @authors tag. See the copyright.txt in the distribution for a
    full listing of individual contributors.

    This is free software; you can redistribute it and/or modify it
    under the terms of the GNU Lesser General Public License as
    published by the Free Software Foundation; either version 2.1 of
    the License, or (at your option) any later version.

    This software is distributed in the hope that it will be useful,
    but WITHOUT ANY WARRANTY; without even the implied warranty of
    MERCHANTABILITY or FITNESS FOR A PARTICULAR PURPOSE. See the GNU
    Lesser General Public License for more details.

    You should have received a copy of the GNU Lesser General Public
    License along with this software; if not, write to the Free
    Software Foundation, Inc., 51 Franklin St, Fifth Floor, Boston, MA
    02110-1301 USA, or see the FSF site: http://www.fsf.org.

-->
<visual-suite-result xmlns:xsi="http://www.w3.org/2001/XMLSchema-instance"
    xmlns="http://www.jboss.org/test/visual-suite-result"
    xsi:schemaLocation="http://www.jboss.org/test/visual-suite-result ../../main/resources/visual-suite-result.xsd">

  <test name="AjaxSupportTestCase.testEmpty">
    <pattern name="p1" result="DIFFER"
        output="diffs/AjaxSupportTestCase.testEmpty.1.png">
      <comparison-result>
        <area width="558" height="1145"/>
        <rectangle>
          <point x="0" y="5"/>
          <point x="10" y="140"/>
        </rectangle>
        <total-pixels>5</total-pixels>
        <masked-pixels>15</masked-pixels>
        <perceptible-different-pixels>345</perceptible-different-pixels>
        <global-different-pixels>53</global-different-pixels>
        <unperceptible-different-pixels>2345</unperceptible-different-pixels>
        <same-pixels>3245</same-pixels>
      </comparison-result>
    </pattern>
    <pattern name="p2" result="SAME"/>
    <pattern name="p3" result="NOT_TESTED"/>
  </test>
  <test name="BeanValidatorTestCase.testAgeIntegerOnly:168">
    <pattern name="p4" result="DIFFER"/>
    <pattern name="p5" result="DIFFER"/>
    <pattern name="p6" result="DIFFER"/>
  </test>
  <test name="xxx">
    <pattern name="p7" result="PERCEPTUALLY_SAME"/>
    <pattern name="p8" result="NOT_TESTED"/>
    <pattern name="p9" result="NOT_TESTED"/>
  </test>
  <test name="yyy">
    <pattern name="p10" result="ERROR">
      <error-output>Stack trace...</error-output>
    </pattern>
    <pattern name="p11" result="SAME"/>
  </test>
</visual-suite-result>